Title,URL,Date Published,Authors,Abstract,Preprocessed_Abstract
MDepthNet based phishing attack detection using integrated deep learning methodologies for cyber security enhancement,https://link.springer.com/article/10.1007/s10586-024-04313-w,29 February 2024,"Anil Kumar Yamarthy, Ch Koteswararao","Developing technologies over digitalization have become more popular and become a threat to society and cybersecurity. Generally, the phishing method is used by hackers to access the data without the influence of users whose data was stolen. Several techniques are used to detect whether the data is phished or non-phished. Some anti-phishing software is used to identify the phishing data. However, few of these techniques did not provide efficient performance. Hence, the proposed model is introduced to overcome the issues obtained and improve the efficiency of detecting whether the data is phished or non-phished. The data is gathered from the Phishstorm dataset, which is pre-processed using the Z score normalization method and data cleaning. Data balancing is done by the Advanced synthetic sampling approach (Adv-SyN) to balance the dataset, and the features are extracted using a Double self-sparse autoencoder (DSelSa). The Opposition Gazelle optimization algorithm (OpGoA) model is used for optimal feature selection, and finally, the data is classified using Multi Head Depth wise Tern integrated long short term memory (MDepthNet). The sooty tern optimization is used to evaluate the loss function of the network model. The performance of the proposed model is analyzed based on some evaluation metrics and compared with other models, which describes the efficiency of the proposed model. The main objective of proposed technique used to detect the phishing attack and phishing or non-phishing. An automated DL methodology introduced for effective detection of phishing attacks for enhancing the cyber security. The accuracy of the proposed model is obtained as 99.45%, and Precision is 99.45%. RMSE and MSE rate of the proposed model is reduced to 0.73 and 0.05 for better performance.",develop technology digitalization become popular become threat society cybersecurity generally phishing method use hacker access data without influence user whose data steal several technique use detect whether data phished nonphished antiphishing software use identify phishing data however technique provide efficient performance hence propose model introduce overcome issue obtain improve efficiency detect whether data phished nonphished data gather phishstorm dataset preprocessed use z score normalization method data cleaning data balance do advanced synthetic sample approach advsyn balance dataset feature extract use double selfsparse autoencoder dselsa opposition gazelle optimization algorithm opgoa model use optimal feature selection finally data classify use multi head depth wise tern integrate long short term memory mdepthnet sooty tern optimization use evaluate loss function network model performance propose model analyze base evaluation metric compare model describes efficiency propose model main objective propose technique use detect phishing attack phishing nonphishing automate dl methodology introduce effective detection phishing attack enhance cyber security accuracy propose model obtain precision rmse mse rate propose model reduce well performance
Enhancing Security and Privacy in Small Drone Networks Using 6G-IOT Driven Cyber Physical System,https://link.springer.com/article/10.1007/s11277-024-11138-8,17 May 2024,"Nagarjuna Tandra, C. N. Gireesh Babu, Jyoti Dhanke, A. V. V. Sudhakar, M. Kameswara Rao, S. Ravichandran","The purpose of this abstract is to present a concise summary of a study that sought to enhance the cybersecurity of 6G-IoT drone devices through the use of a layered architectural framework and machine learning methodologies. An improved seven-layered architecture that can classify various types of attacks with a 99% accuracy rate is presented in the paper as a means to enhance drone security and privacy. You may encounter Prob, DoS, R2L, and U2R assaults, among others. On the drone dataset, the RegressionNet model—a combination of Logistic Regression and Multilayer Perceptron—performs best. Impressively, it attains a rate of 99.89% accuracy. Both the STIN security dataset and a combined dataset underwent additional validation testing, with the combined dataset producing an average accuracy of 97.90% and the STIN security dataset 91.64%, respectively, proving that the suggested method is both effective and resilient. By enhancing the cybersecurity of 6G-IoT drones, We can see the importance of the suggested architecture and ML models from these outcomes. This, in turn, guarantees secure drone operations across many fields while reducing privacy issues.",purpose abstract present concise summary study sought enhance cybersecurity giot drone device use layer architectural framework machine learn methodology improve sevenlayered architecture classify various type attack accuracy rate present paper mean enhance drone security privacy may encounter prob do rl ur assault among others drone dataset regressionnet modela combination logistic regression multilayer perceptronperforms best impressively attains rate accuracy stin security dataset combine dataset underwent additional validation test combine dataset produce average accuracy stin security dataset respectively prove suggest method effective resilient enhance cybersecurity giot drone see importance suggest architecture ml model outcome turn guarantee secure drone operation across many field reduce privacy issue
Cyber security analysis based medical image encryption in cloud IoT network using quantum deep learning model,https://link.springer.com/article/10.1007/s11082-023-06076-x,27 January 2024,Jing Wang,"A very high degree of security is required for the transmission of medical pictures via open access as these images are more important than other types of images in most applications, especially real-time applications like telemedicine. The rapid advancement of artificial intelligence (AI) technology has made the privacy and security of patient medical picture data an urgent issue in the field of image privacy protection. By combining quantum deep learning with cyber security research of cloud IoT networks, this study proposes a novel approach to encrypting medical photos. Here, a stream crypto cypher and deep, extreme convolutional networks encrypt the medical image. Afterwards, this encrypted picture was stored using a secure cloud IoT infrastructure. Encryption speed, structural similarity index measure (SSIM), root mean square error (RMSE), mean average precision (MAP), and peak signal-to-noise ratio (PSNR) are all used in the experimental investigation. To determine the efficacy of the proposed approach, experimental analyses and simulations were carried out. PSNR was 92%, RMSE was 85%, SSIM was 68%, MAP was 52%, and encryption speed was 88% using the suggested method.",high degree security require transmission medical picture via open access image important type image application especially realtime application like telemedicine rapid advancement artificial intelligence ai technology make privacy security patient medical picture data urgent issue field image privacy protection combine quantum deep learn cyber security research cloud iot network study proposes novel approach encrypt medical photo stream crypto cypher deep extreme convolutional network encrypt medical image afterwards encrypt picture store use secure cloud iot infrastructure encryption speed structural similarity index measure ssim root mean square error rmse mean average precision map peak signaltonoise ratio psnr use experimental investigation determine efficacy propose approach experimental analysis simulation carry psnr rmse ssim map encryption speed use suggest method
From scattered data to actionable knowledge: flexible cyber security reporting in the military domain,https://link.springer.com/article/10.1007/s10207-022-00613-7,14 September 2022,"Florian Skopik, Arndt Bonitz, Volker Grantz, Günter Göhler","Numerous cyber situational awareness models have been proposed in recent years. Yet, one of the main challenges still remains mostly unsolved, which is what information sources contribute to the process for establishing cyber situational awareness and how is relevant information collected. While previous scientific works focused on situational awareness models and decision support based on common operating pictures, ingesting and maintaining a consistent data basis for the cyber domain has rarely been studied in detail. However, this is crucial when data distributed across different systems need to be collected, vetted, correlated, de-duplicated, enriched and finally stored as a basis for flexible cyber security reporting. In this paper, we design an approach and a data model that enable to ingest and store the essential information from disparate organizational units and act as a basis for the flexible creation of cyber security reports. We describe the application of this approach and model in a case study together with the Austrian Ministry of Defense (MoD), in which we surveyed existing data sources and transfer paths and rated the applicability of the CCOP data model and accompanying processes in course of a proof-of-concept implementation.",numerous cyber situational awareness model propose recent year yet one main challenge still remains mostly unsolved information source contribute process establish cyber situational awareness relevant information collect previous scientific work focus situational awareness model decision support base common operating picture ingest maintain consistent data basis cyber domain rarely study detail however crucial data distribute across different system need collect vet correlate deduplicated enrich finally store basis flexible cyber security reporting paper design approach data model enable ingest store essential information disparate organizational unit act basis flexible creation cyber security report describe application approach model case study together austrian ministry defense mod survey exist data source transfer path rat applicability ccop data model accompany process course proofofconcept implementation
Cyber-security and risky behaviors in a developing country context: a Pakistani perspective,https://link.springer.com/article/10.1057/s41284-022-00343-4,29 May 2022,"Naurin Farooq Khan, Naveed Ikram, Sumera Saleem, Saad Zafar","Cyber-security behavior research is scant with even scarce studies carried out in developing countries. We examine the cyber-security and risky Internet behaviors of undergraduate students from Pakistan, taking into account the diversity of these students in terms of demographics, socioeconomic status, and the digital divide. Data were collected using a survey questionnaire. A total of 294 students belonging to six different cities of Pakistan were surveyed employing multistage stratified sampling in face-to-face interaction. The results indicated significant differences of cyber-security posture in terms of gender, age and digital divide variables. The profiles of students based on cyber-security and risky Internet behaviors indicate three groups with a majority of them falling into group that exhibits more risk-averse yet low cyber-security behavior. Moreover, proactive cyber-security awareness behavior has a positive impact on high risk-averse behavior. The implications of the findings are studied in terms of providing customized training and awareness. The future directions are laid out for further explorations in terms of cultural differences within and cross-country contexts.",cybersecurity behavior research scant even scarce study carry develop country examine cybersecurity risky internet behavior undergraduate student pakistan take account diversity student term demographic socioeconomic status digital divide data collect use survey questionnaire total student belonging six different city pakistan survey employ multistage stratify sample facetoface interaction result indicate significant difference cybersecurity posture term gender age digital divide variable profile student base cybersecurity risky internet behavior indicate three group majority fall group exhibit riskaverse yet low cybersecurity behavior moreover proactive cybersecurity awareness behavior positive impact high riskaverse behavior implication finding study term provide customize training awareness future direction laid exploration term cultural difference within crosscountry context
Hyper-heuristic multi-objective online optimization for cyber security in big data,https://link.springer.com/article/10.1007/s13198-022-01727-w,17 July 2022,"Mohammed Ahmed, G. Rama Mohan Babu","The tremendous growth in data inside the Big data era has created data management challenges as well as data security concerns. These large data cyber security challenges can be successfully addressed with AI computations, with the SVM providing the best results on big data order issues. Master information in picking the kernel work and different boundaries is required to characterize the correct design of the SVM, and this can significantly advance its arrangement outcomes. The fake positive rate, bogus negative rate, and model unpredictability boundaries addressed using the SVM arrangement process is shown to be a multi-objective optimization problem in this study. The hyper-heuristic online particle swarm optimization (HHOPSO) computation with the SVM multi-objective optimization problem, a hyper-heuristic online particle swarm optimization system is produced was presented. The hyper-heuristic system comprises a high-level technique for directing the search process for determining low-level heuristics, and the low-level heuristics build new SVM setup configurations using various PSO standards. The proposed HHOPSO was evaluated on two cyber security datasets i.e., NSL-KDD and ISCX-IDS. The results revealed that the suggested approach is more effective than other calculations in refining the order of big data cyber security issues. The designed HHOPSO can classify cyber-attacks like DoS, Probe, R2L, and U2R with an accuracy of 93.23%.",tremendous growth data inside big data era create data management challenge well data security concern large data cyber security challenge successfully address ai computation svm provide best result big data order issue master information pick kernel work different boundary require characterize correct design svm significantly advance arrangement outcome fake positive rate bogus negative rate model unpredictability boundary address use svm arrangement process show multiobjective optimization problem study hyperheuristic online particle swarm optimization hhopso computation svm multiobjective optimization problem hyperheuristic online particle swarm optimization system produce present hyperheuristic system comprises highlevel technique direct search process determine lowlevel heuristic lowlevel heuristic build new svm setup configuration use various pso standard propose hhopso evaluate two cyber security datasets ie nslkdd iscxids result reveal suggest approach effective calculation refining order big data cyber security issue design hhopso classify cyberattacks like do probe rl ur accuracy
Proposed cancelable biometrics system based on hybrid optical crypto-steganography audio framework for cyber security applications,https://link.springer.com/article/10.1007/s11042-024-18232-w,08 July 2024,Mai Helmy,"Biometric authentication systems have gained significant popularity in recent years due to their high level of security and convenience. Cancelable biometrics is a promising area of research that addresses the privacy and security concerns associated with traditional biometric systems. By transforming the biometric data in a non-invertible manner, cancelable biometrics offer enhanced privacy protection, increased security, and the flexibility to revoke or update biometric templates. As research in this field continues to advance, cancelable biometrics has the potential to revolutionize the way biometric systems are implemented and utilized. Ten years ago, there is a dire need to develop new cancelable biometric systems depending on cryptography or steganography system which may merging the two previous techniques to hide secret information within a cover medium. It involves encrypting the message and then embedding it into an innocent-looking file, such as an image or audio file. The goal is to make the hidden message undetectable to anyone who is not the intended recipient. This method ensures that even if the cover medium is intercepted, the secret information remains secure. Crypto-steganography is a powerful tool for covert communication and has applications in various fields, including intelligence agencies, cyber-security, and digital multimedia applications. In a classical cryptography system, users can easily change their password if they are compromised. However, user's biometrics is limited and unique, and if they are compromised, it will be impossible to change them as it in cryptography system. So, the basic concept of cancelable biometrics is to use another version of the original biometric template created through a one-way transform or a crypto-steganography scheme to keep the original biometrics safe and away from utilization in the system. Cancelable biometrics depends on the transformation of data so that users can replace their single biometric template in the same or different system. In this paper, a biometric system is presented as a novel hybrid optical crypto-steganography algorithm which is used to achieve cancelability option over audios signal. A proposal hybrid crypto-steganography technique based on the optical Double Random Phase Encoding (DRPE) algorithm which is suggested to attain simultaneous encryption of multi-audios, begins with encrypting the biometric audios using the optical DRPE algorithm, then the resulting encrypted biometric audios are further encrypted again with the chaotic Baker map as a permutation strategy, Advanced Encryption Standard (AES), and Ron's Code (RC6) as a diffusion strategy. Then, the resulting encrypted biometrics is embedded into the cover media with a steganography technique which is based on a chaotic concept. Finally, the quality evaluation of the proposed cancelable biometrics system reveals good performance. The simulation results prove that the suggested hybrid optical crypto-steganography framework is reliable and presents recommended security and robustness levels for its utilization in achieving efficient cancelable biometrics systems compared to traditional techniques.",biometric authentication system gain significant popularity recent year due high level security convenience cancelable biometrics promising area research address privacy security concern associate traditional biometric system transform biometric data noninvertible manner cancelable biometrics offer enhance privacy protection increase security flexibility revoke update biometric template research field continue advance cancelable biometrics potential revolutionize way biometric system implement utilized ten year ago dire need develop new cancelable biometric system depend cryptography steganography system may merge two previous technique hide secret information within cover medium involves encrypt message embed innocentlooking file image audio file goal make hidden message undetectable anyone intend recipient method ensures even cover medium intercept secret information remains secure cryptosteganography powerful tool covert communication application various field include intelligence agency cybersecurity digital multimedia application classical cryptography system user easily change password compromise however user biometrics limited unique compromise impossible change cryptography system basic concept cancelable biometrics use another version original biometric template create oneway transform cryptosteganography scheme keep original biometrics safe away utilization system cancelable biometrics depends transformation data user replace single biometric template different system paper biometric system present novel hybrid optical cryptosteganography algorithm use achieve cancelability option audio signal proposal hybrid cryptosteganography technique base optical double random phase encode drpe algorithm suggest attain simultaneous encryption multiaudios begin encrypt biometric audio use optical drpe algorithm result encrypt biometric audio encrypt chaotic baker map permutation strategy advanced encryption standard aes ron code rc diffusion strategy result encrypt biometrics embed cover medium steganography technique base chaotic concept finally quality evaluation propose cancelable biometrics system reveals good performance simulation result prove suggest hybrid optical cryptosteganography framework reliable present recommend security robustness level utilization achieve efficient cancelable biometrics system compare traditional technique
Analysis of Cross-Domain Security and Privacy Aspects of Cyber-Physical Systems,https://link.springer.com/article/10.1007/s10776-022-00559-6,04 July 2022,"Kamal Prasat, S. Sanjay, V. Ananya, R. Kannadasan, S. Rajkumar, Roshani Raut, Ramani Selvanambi","Cyber-physical systems (CPSs) are the recent surfacing of engineered systems in which the integration of computing, communication, and control technologies are so secure. Many important application fields such as transportation, energy, and medical systems employ Cyber-physical systems as the basic engineering systems which we conclude from various researches. The rapid and important development of CPS is affecting many aspects of people's lifestyles, enabling a wide range of applications and services such as Smart Home, E-Health, and ecommerce. They have the capability to consolidate sensor networks with implanted processing to screen and control the actual environment, with input circles that permits this outside boost to self-initiate either correspondence, control or registering. In spite of their various benefits, CPS frameworks are inclined to different digital and additionally actual security dangers, assaults and difficulties. This is because of their heterogeneous nature, their dependence on private information, and their enormous scope arrangement. Thus, purposeful or unplanned openings of these frameworks can result in calamitous impacts, which makes it basic to set up vigorous safety efforts. Currently, there is an increase in the present security confrontation with the epidemic growth of cyber-physical systems. There has been an influx of susceptibility, risks, attacks, and controls for the emerging latest generation of CPS. This paper overviews the security of cyber-physical systems along with the exploration of various cyber-attacks associated with CPS. Furthermore, this paper gives us a clear picture of various applications in several domains as well as the CPS in various emerging technologies.",cyberphysical system cps recent surface engineer system integration compute communication control technology secure many important application field transportation energy medical system employ cyberphysical system basic engineering system conclude various research rapid important development cps affect many aspect people lifestyle enable wide range application service smart home ehealth ecommerce capability consolidate sensor network implant processing screen control actual environment input circle permit outside boost selfinitiate either correspondence control register spite various benefit cps framework inclined different digital additionally actual security danger assault difficulty heterogeneous nature dependence private information enormous scope arrangement thus purposeful unplanned opening framework result calamitous impact make basic set vigorous safety effort currently increase present security confrontation epidemic growth cyberphysical system influx susceptibility risk attack control emerge late generation cps paper overview security cyberphysical system along exploration various cyberattacks associate cps furthermore paper give u clear picture various application several domain well cps various emerge technology
