Title,URL,Date Published,Authors,Abstract,Preprocessed_Abstract
A study on building awareness in cyber security for educational system in India using interpretive structural modellings,https://link.springer.com/article/10.1007/s13198-024-02273-3,29 February 2024,"Sachi Nandan Mohanty, Tilottama Singh, Richa Goel, Sukanta Kumar Baral, Rakesh Kumar","The aim of this study to find out awareness of cyber security education in India. This Study applies unifies theory model named Interpretive Structural Modelling (ISM). Cybersecurity is crucial to the information technology industry. The first thing that springs to mind whenever we consider cyber security is the enormous daily increase in cybercrimes. This Study Finds challenges and future scope of Cyber security education in India. Data collected from the introduction of E-learning and Bring Your Own Device (BYOD) programmes into the educational system. Study also finds that there has been a noticeable increase in internet usage, mostly among students. The Study found many challenging impacts of using of access of internet for children like cyberbullying, increasing of various threat actors, online scams, online gaming and even phishing of emails. These all challenges have seen actively among the children. There have been government initiatives which have been taken to protect children and even women to protect women as well. Based on past research, this study will focus in determining the various implementing challenges of cybersecurity education in India for which an ISM model is performed.The study discusses the remedies for the cybersecurity education in the institutions.",aim study find awareness cyber security education india study applies unifies theory model name interpretive structural model ism cybersecurity crucial information technology industry first thing spring mind whenever consider cyber security enormous daily increase cybercrime study find challenge future scope cyber security education india data collect introduction elearning bring device byod programme educational system study also find noticeable increase internet usage mostly among student study found many challenge impact use access internet child like cyberbullying increase various threat actor online scam online game even phishing email challenge see actively among child government initiative take protect child even woman protect woman well base past research study focus determine various implement challenge cybersecurity education india ism model performedthe study discus remedy cybersecurity education institution
Securing the remote office: reducing cyber risks to remote working through regular security awareness education campaigns,https://link.springer.com/article/10.1007/s10207-023-00809-5,29 January 2024,"Giddeon Njamngang Angafor, Iryna Yevseyeva, Leandros Maglaras","Cyber security threats, including risks to remote workers, are varied and diverse, with the number of scams and business email compromise breaches increasing. Firms and their staff are experiencing mass phishing attacks, several typical precursors to more sinister attacks like cyber-enabled fraud, ransomware, and denial of service (DDoS) attacks. Threat actors are leveraging new technologies such as machine learning and artificial intelligence (AI) to deliver sophisticated scam and phishing messages that are challenging for users to identify as malicious. Several businesses are increasing technical efforts in critical areas, including network hardening, robust patching, anti-malware, ransomware detection applications, and multi-factor authentication to detect, prevent, and recover from potential threats. Despite that, these measures provide only a partial solution if the users who access the systems do not have good security awareness training. In this study, we review some cyber risks related to remote working and detail how they can be remediated through regular security awareness education campaigns (SAECs). The study presents the results of a proof of concept (PoC) experiment conducted to establish the value of regular SAECs in the fight against scams and phishing attacks against remote workers. The pilot results confirm that securing the remote office requires a robust SAEC. It argues that to be successful and help staff protect business systems and data, SAECs must be regular and varied, providing opportunities for staff to understand what to look for in suspicious scams and phishing emails. Moreover, they must provide opportunities for staff to practice their knowledge and understanding through practical exercises such as spam and phishing simulation exercises, which could help users avoid falling victim to spam and phishing emails.",cyber security threat include risk remote worker varied diverse number scam business email compromise breach increase firm staff experience mass phishing attack several typical precursor sinister attack like cyberenabled fraud ransomware denial service ddos attack threat actor leverage new technology machine learn artificial intelligence ai deliver sophisticated scam phishing message challenge user identify malicious several business increase technical effort critical area include network harden robust patch antimalware ransomware detection application multifactor authentication detect prevent recover potential threat despite measure provide partial solution user access system good security awareness training study review cyber risk related remote work detail remediate regular security awareness education campaign saecs study present result proof concept poc experiment conduct establish value regular saecs fight scam phishing attack remote worker pilot result confirm secure remote office require robust saec argues successful help staff protect business system data saecs must regular varied provide opportunity staff understand look suspicious scam phishing email moreover must provide opportunity staff practice knowledge understand practical exercise spam phishing simulation exercise could help user avoid fall victim spam phishing email
Blockchain-based cyber-security trust model with multi-risk protection scheme for secure data transmission in cloud computing,https://link.springer.com/article/10.1007/s10586-024-04481-9,16 April 2024,"Mohd Akbar, Mohammed Mujtaba Waseem, Syeda Husna Mehanoor, Praveen Barmavatu","The rise of cloud computing has transformed the way data is stored and managed, yet it has also brought about major security issues, especially concerning the secure transfer of data within cloud systems. In response to these challenges, this research develops a comprehensive cyber-security trust model that provides multi-risk protection for secure data transmission in cloud computing, ensuring the highest level of privacy and data security. This innovative approach aims to ensure the secure transmission of data in cloud computing while harnessing the combined strengths of Quantum Key Distribution (QKD) and Advanced Encryption Algorithm. As cloud environments become integral to modern business operations, safeguarding data against a multitude of security risks, including traditional and emerging threats, is paramount. The Cyber-Security Trust Model leverages blockchain to establish a transparent and tamper-resistant ledger of all data transactions within the cloud. This blockchain layer enhances data integrity, auditability, and traceability while also providing a decentralized and trust-based framework for authentication and authorization. The Multi-Risk Protection Model incorporates both Quantum Key Distribution (QKD) and a Modified Advanced Encryption Standard (MAES) to offer multi-layered defence mechanisms. Through rigorous testing and analysis, this study demonstrates the feasibility and effectiveness of the proposed Cyber-Security Trust Model with a Merkle tree-based solution for data integrity verification. It makes a significant impact on the field of secure data transmission in cloud computing by providing strong protection against a constantly changing set of security threats. MATLAB is employed to conduct rigorous experiments, analyse results, and validate the model’s performance in various cloud computing scenarios. The findings of the proposed study show the proposed method, combining Quantum Key Distribution (QKD) and Modified AES (MAES), stands out with exceptional performance, featuring encryption and decryption times of 2.25ms and 1.071ms, respectively. The proposed system outperforms all others, boasting an impressive accuracy rate of 99.84%. This research signifies a ground-breaking advancement in cloud computing security, addressing a spectrum of traditional and emerging threats through a multi-risk protection model incorporating Quantum Key Distribution (QKD) and MAES while demonstrating exceptional performance in rigorous experiments.",rise cloud compute transform way data store manage yet also brought major security issue especially concern secure transfer data within cloud system response challenge research develops comprehensive cybersecurity trust model provide multirisk protection secure data transmission cloud compute ensure high level privacy data security innovative approach aim ensure secure transmission data cloud compute harness combine strength quantum key distribution qkd advanced encryption algorithm cloud environment become integral modern business operation safeguard data multitude security risk include traditional emerge threat paramount cybersecurity trust model leverage blockchain establish transparent tamperresistant ledger data transaction within cloud blockchain layer enhances data integrity auditability traceability also provide decentralize trustbased framework authentication authorization multirisk protection model incorporates quantum key distribution qkd modify advanced encryption standard maes offer multilayered defence mechanism rigorous test analysis study demonstrates feasibility effectiveness propose cybersecurity trust model merkle treebased solution data integrity verification make significant impact field secure data transmission cloud compute provide strong protection constantly change set security threat matlab employ conduct rigorous experiment analyse result validate model performance various cloud compute scenario finding propose study show propose method combine quantum key distribution qkd modify aes maes stand exceptional performance feature encryption decryption time m m respectively propose system outperforms others boasting impressive accuracy rate research signifies groundbreaking advancement cloud compute security address spectrum traditional emerge threat multirisk protection model incorporate quantum key distribution qkd maes demonstrate exceptional performance rigorous experiment
A personalized learning theory-based cyber-security training exercise,https://link.springer.com/article/10.1007/s10207-023-00704-z,02 June 2023,"Nabin Chowdhury, Vasileios Gkioulos","Current enterprises’ needs for skilled cyber-security (CS) professionals have prompted the development of diverse CS training programs and offerings. It has been noted that even though enterprise staff is now more aware of security threats, the number of successful attacks against companies has all but decreased over the years. Several criticisms were raised against current CS training offerings, which often made them inadequate, or unable to change participants’ behavior and security attitude. One of the main factors CS training programs are often not very effective is the lack of engagement or motivation of participants. This is often the result of training not being tailored to the needs or preferences of participants. In our previous work, we tackled this issue by developing a personalized learning theory-based model for developing CS training frameworks. In this work, we utilize the model to develop two CS training exercises: two game-based scenarios using the CS training video game Cyber CIEGE and one table-top team exercise. The exercises are later tested by involving a group of 12 students from the Norwegian Institute of Science and Technology (NTNU) Information Security master’s degree program. According to the results of the experiment and the feedback from the students, students felt more engaged during the exercises due to having been participants in their development process. This has in turn motivated them to continue using the training tools independently in their spare time. Further research is recommended to establish whether the training development model is adequate for different target groups, as well as better performing than other models when developing full-fledged training programs.",current enterprise need skilled cybersecurity c professional prompt development diverse c training program offering note even though enterprise staff aware security threat number successful attack company decrease year several criticism raise current c training offering often make inadequate unable change participant behavior security attitude one main factor c training program often effective lack engagement motivation participant often result training tailor need preference participant previous work tackle issue develop personalize learn theorybased model develop c training framework work utilize model develop two c training exercise two gamebased scenario use c training video game cyber ciege one tabletop team exercise exercise later test involve group student norwegian institute science technology ntnu information security master degree program accord result experiment feedback student student felt engage exercise due participant development process turn motivate continue use training tool independently spare time research recommend establish whether training development model adequate different target group well well perform model develop fullfledged training program
Cyber Security Threats Detection in IoT Using Krill Based Deep Neural Network Stacked Auto Encoders,https://link.springer.com/article/10.1007/s11277-024-11002-9,01 March 2024,"Pragati Rana, Sanjeev Chauhan, B. P. Patil","The Internet of things (IoT) has concerned much significance for some manufacturing sectors including clinical fields, co-ordinations following, savvy urban communities, and automobiles. Anyway as a worldview, it is sensitive to different sorts of cyber-attacks. Customary very good quality security resolutions for guarantee an IoT structure are not reasonable. This deduces clever organization-based security plans as AI arrangements ought to be made. In this work, we propose Cyber Security Threats recognition in IoT utilizing Krill Based Deep Neural Network Stacked Auto Encoders (KDNN-SAE). In our proposed approach, first, the information pre-processing measure was acted in the underlying development before isolating the dataset into two segments: preparing and test. At that point, flow-based features are extracted from the pre-processed information. By then, the properties to be utilized by the algorithms are chosen in the attribute determination utilizing the Genetic Algorithm (GA). At last, our methodology completes with the execution of the machine learning algorithm KDNN-SAE. The experimental outcome proposed accuracy of is 99.37%. Comparable to the exiting SVM which achieves 98%, K-NN which achieves 98%. The NB and RF had less Accuracy 90%, 92%.",internet thing iot concerned much significance manufacturing sector include clinical field coordination follow savvy urban community automobile anyway worldview sensitive different sort cyberattacks customary good quality security resolution guarantee iot structure reasonable deduces clever organizationbased security plan ai arrangement ought make work propose cyber security threat recognition iot utilize krill base deep neural network stack auto encoders kdnnsae propose approach first information preprocessing measure act underlie development isolate dataset two segment prepare test point flowbased feature extract preprocessed information property utilized algorithm chosen attribute determination utilize genetic algorithm ga last methodology completes execution machine learn algorithm kdnnsae experimental outcome propose accuracy comparable exit svm achieves knn achieves nb rf less accuracy
A Comprehensive Review on Deep Learning Techniques on Cyber Attacks on Cyber Physical Systems,https://link.springer.com/article/10.1007/s42979-024-03253-x,20 September 2024,"Maloth Sagar, C. Vanmathi","Cyber-Physical Systems (CPSs), which integrate control, computing, and communication, are considered as next-generation intelligent systems.A major concern in CPS is to ensure security. If security is not ensured, then it leads to both property damage and casualties.Since CPS is closely associated with real life, it is a hot research area in present security research. Nevertheless, cyber security issues are also raised. More efforts are still required for understanding CPS security from a more comprehensive perspective even though there are several studies on CPS cybersecurity.To identify and detect cyber security in CPS, numerous methods have been applied. The majority of recently published studies focused on Machine Learning (ML) techniques, with little attention paid to the development of Deep Learning (DL). Hence, the analysis of cyber security on CPS utilizing several algorithms of DL techniques is systematically reviewed.The appropriate cyber security risk levels and their corresponding detection and mitigation processesare determined. This study could augment the adaptability of the system of CPS data. Also, it could increase the generalization of the models of security attacks in CPS. Using DL algorithms is strongly recommended by most authors as a means to identify cyber security issues in CPS.The CNN-centric LSTM, Deep Multi-architectural Approach, and DL-Meta classifier attained the highest accuracy in the detection rate of cyber security attacks in CPS when analogized with the other algorithms in DL techniques. Hence, for several critical systems in CPSs, the result renders clear guidelines to apply other regularization on DL techniques.",cyberphysical system cps integrate control compute communication consider nextgeneration intelligent systemsa major concern cps ensure security security ensure lead property damage casualtiessince cps closely associate real life hot research area present security research nevertheless cyber security issue also raise effort still require understand cps security comprehensive perspective even though several study cps cybersecurityto identify detect cyber security cps numerous method apply majority recently publish study focus machine learn ml technique little attention paid development deep learn dl hence analysis cyber security cps utilize several algorithm dl technique systematically reviewedthe appropriate cyber security risk level correspond detection mitigation processesare determine study could augment adaptability system cps data also could increase generalization model security attack cps use dl algorithm strongly recommend author mean identify cyber security issue cpsthe cnncentric lstm deep multiarchitectural approach dlmeta classifier attain high accuracy detection rate cyber security attack cps analogize algorithm dl technique hence several critical system cps result render clear guideline apply regularization dl technique
Smart Cities and Transportation Based Vehicle-To-Vehicle Communication and Cyber Security Analysis Using Machine Learning Model in 6G Network,https://link.springer.com/article/10.1007/s11277-024-11183-3,01 June 2024,"Shurui Kong, Kemeng Wang, Caiying Feng, Junjie Wang","Increasing number of sensor-centric communication and computer equipment installed inside cars for various purposes, such as vehicle monitoring, physical wiring reduction, driving efficiency, has made in-vehicle communication an essential part of today’s driving environment. However, the relevant literature on cyber security for in-vehicle communication systems does not currently offer any targeted, workable solutions for in-vehicle cyber hazards. Current solutions usually rely on protocol-specific security techniques rather than providing a comprehensive security framework for in-vehicle communication. Cyber-physical systems (CPSs) are emergent systems that use a cyber-communication infrastructure to enable efficient real-time control and collaboration (C&C) of physical components, such as actuators, sensors, control systems, and the surrounding environment. This study analyses how smart cities are transported using machine learning models in 6G networks to analyse cyber security through vehicle-to-vehicle communication. In this case, vehicle-to-vehicle communication uses 6G networks that are built on the Internet of Things. Subsequently, reinforcement quantile spatial convolutional neural networks (RQSCNN) are used to perform the cyber security analysis. Throughput, Quality of Service (QoS), latency, computational cost, data transfer rate are all considered in experimental investigation. As a result, the suggested model can be applied in high-speed, high-throughput internal communication contexts of automobiles and accurately characterise both the nature and presence or absence of attacks.",increase number sensorcentric communication computer equipment instal inside car various purpose vehicle monitoring physical wiring reduction drive efficiency make invehicle communication essential part today drive environment however relevant literature cyber security invehicle communication system currently offer target workable solution invehicle cyber hazard current solution usually rely protocolspecific security technique rather provide comprehensive security framework invehicle communication cyberphysical system cps emergent system use cybercommunication infrastructure enable efficient realtime control collaboration cc physical component actuator sensor control system surround environment study analysis smart city transport use machine learn model g network analyse cyber security vehicletovehicle communication case vehicletovehicle communication us g network built internet thing subsequently reinforcement quantile spatial convolutional neural network rqscnn use perform cyber security analysis throughput quality service qos latency computational cost data transfer rate consider experimental investigation result suggest model apply highspeed highthroughput internal communication context automobile accurately characterise nature presence absence attack
Navigating digital divide: exploring the influence of ideological and political education on cyber security and digital literacy amid information warfare,https://link.springer.com/article/10.1007/s12144-024-06106-1,23 May 2024,Baihang Huang,"This study investigates the intricate relationship between ideological and political education (IPE), cyber security, and digital literacy within the context of online information warfare, aiming to shed light on strategies for navigating the digital divide. Utilizing a quantitative research approach and convenience sampling, data were collected through a meticulously crafted online survey from a diverse range of participants, including students, professionals, and other individuals. Analysis of the data, conducted using SPSS software and Smart-PLS 3, revealed several significant findings. Firstly, there exists a pronounced disparity in access to diverse online information based on individuals’ levels of IPE. Additionally, media literacy skills exhibit significant variation across different levels of IPE. Furthermore, the study elucidates how IPE influences individuals’ propensity to engage in online echo chambers and their susceptibility to cyber security vulnerabilities. Finally, it underscores the role of IPE in shaping digital participation and civic engagement. Overall, this research contributes novel insights into the complex dynamics of online information warfare and highlights the pivotal role of ideological and political education in mitigating the digital divide. This study underscores the critical importance of IPE in shaping individuals’ digital literacy, cyber security awareness, and engagement with online information environments. By elucidating the impact of IPE on navigating the digital divide, this research contributes valuable insights for policymakers, educators, and stakeholders seeking to foster a more informed, resilient, and inclusive digital society.",study investigates intricate relationship ideological political education ipe cyber security digital literacy within context online information warfare aim shed light strategy navigate digital divide utilize quantitative research approach convenience sample data collect meticulously craft online survey diverse range participant include student professional individual analysis data conduct use spss software smartpls reveal several significant finding firstly exists pronounce disparity access diverse online information base individual level ipe additionally medium literacy skill exhibit significant variation across different level ipe furthermore study elucidates ipe influence individual propensity engage online echo chamber susceptibility cyber security vulnerability finally underscore role ipe shape digital participation civic engagement overall research contributes novel insight complex dynamic online information warfare highlight pivotal role ideological political education mitigate digital divide study underscore critical importance ipe shape individual digital literacy cyber security awareness engagement online information environment elucidate impact ipe navigate digital divide research contributes valuable insight policymakers educator stakeholder seek foster inform resilient inclusive digital society
