Title,URL,Date Published,Authors,Abstract,Preprocessed_Abstract
Enhancing IoT cyber attacks intrusion detection through GAN-based data augmentation and hybrid deep learning models for MQTT network protocol cyber attacks,https://link.springer.com/article/10.1007/s10586-024-04752-5,04 November 2024,"Hayette Zeghida, Mehdi Boulaiche, Ramdane Chikh, Alwi M. Bamhdi, Ana Luiza Bessa Barros, Djamel Zeghida, Ahmed Patel","In the evolving digital landscape, interconnected IoT networks are expanding fast. However, essential security measures are often lacking, which makes it vulnerable to cyber threats. Intrusion Detection Systems (IDSs) are crucial in combating these threats, but IDSs in the IoT domain face significant challenges; one of them is the existence of imbalanced data, where attack activities are underrepresented compared to normal activities. This becomes a problem when handling Machine Learning (ML) tasks to improve the system’s intrusion detection ability. This paper presents a novel solution by leveraging Generative Adversarial Networks (GANs) to create balanced datasets. Unlike traditional methods, our approach generates high-quality synthetic samples that maintain the intricate characteristics of the data, making it possible to improve detection accuracy. Additionally, we introduce three specialized IDSs designed to detect attacks on the lightweight Message Queuing Telemetry Transport (MQTT) protocol, utilizing hybrid Deep Learning (DL) algorithms (CNN-RNN, CNN-LSTM, and CNN-GRU). Experimental results, using a combination of both the original MQTT dataset and a newly generated dataset through GANs, demonstrate the better performance of the generated datasets in multi-class classification. This performance highlights the effectiveness of our GAN-based approach in improving detection accuracy at the same time that it reduces false positives. The ultimate objective is to develop an autonomous system tailored to safeguard IoT environments, providing a robust and adaptable solution to emerging cyber threats.",evolve digital landscape interconnect iot network expand fast however essential security measure often lack make vulnerable cyber threat intrusion detection system id crucial combat threat id iot domain face significant challenge one existence imbalanced data attack activity underrepresented compare normal activity becomes problem handle machine learn ml task improve system intrusion detection ability paper present novel solution leverage generative adversarial network gans create balance datasets unlike traditional method approach generates highquality synthetic sample maintain intricate characteristic data make possible improve detection accuracy additionally introduce three specialized id design detect attack lightweight message queue telemetry transport mqtt protocol utilize hybrid deep learn dl algorithm cnnrnn cnnlstm cnngru experimental result use combination original mqtt dataset newly generate dataset gans demonstrate well performance generate datasets multiclass classification performance highlight effectiveness ganbased approach improve detection accuracy time reduces false positive ultimate objective develop autonomous system tailor safeguard iot environment provide robust adaptable solution emerge cyber threat
Adequate responses to cyber-attacks,https://link.springer.com/article/10.1365/s43439-024-00116-2,04 April 2024,"Fabian M. Teichmann, Sonia R. Boticiu","Cybersecurity has become a prominent issue for companies in all sectors. Businesses need to ensure that they have taken the necessary measures and have methodically prepared for a cybersecurity incident. The impact of a cyber-attack can be significantly reduced by a company’s ability to react quickly to unexpected events. This article aims to highlight ways to reduce the likelihood and impact of a cyber-attack and provide a clear understanding of the critical steps and appropriate responses to such attacks. Even though cyber risk has become one of the most critical operational risks for firms, the literature has not yet sufficiently addressed the practical ways companies can reduce exposure and mitigate these risks. Therefore, this article contributes to the literature by providing immediate steps that organizations should take in three possible situations, before, during, and after a cyber-attack.",cybersecurity become prominent issue company sector business need ensure take necessary measure methodically prepared cybersecurity incident impact cyberattack significantly reduce company ability react quickly unexpected event article aim highlight way reduce likelihood impact cyberattack provide clear understand critical step appropriate response attack even though cyber risk become one critical operational risk firm literature yet sufficiently address practical way company reduce exposure mitigate risk therefore article contributes literature provide immediate step organization take three possible situation cyberattack
The evolution of ransomware attacks in light of recent cyber threats. How can geopolitical conflicts influence the cyber climate?,https://link.springer.com/article/10.1365/s43439-023-00095-w,13 July 2023,"Fabian Teichmann, Sonia R. Boticiu, Bruno S. Sergi","This article aims to analyze the current unpredictable cyber climate. In particular, Russia’s invasion of Ukraine has heightened concerns about security incidents, and ransomware attacks have become a credible threat to businesses around the world. Ransomware attackers often target large companies or companies holding sensitive data, and companies have suffered significant losses in monetary terms and business opportunities. The main research methodology used for this study is desk research. Specifically, an extensive literature review was conducted on the latest trends in ransomware and geopolitical conflict in order to provide an overview of the current cyber climate in light of recent events. We contribute to the literature by investigating recent ransomware attacks, focusing on how the ransom is paid, how the money is transferred to the criminals, how the cryptocurrencies might be recovered, and how sustainability and cybersecurity are linked. These issues have yet to be sufficiently debated amid the latest events in Ukraine and the ransomware gangs’ involvement in geopolitical conflicts. This study provides researchers with a means of assessing vulnerabilities, revealing a path for intended research.",article aim analyze current unpredictable cyber climate particular russia invasion ukraine heighten concern security incident ransomware attack become credible threat business around world ransomware attacker often target large company company hold sensitive data company suffer significant loss monetary term business opportunity main research methodology use study desk research specifically extensive literature review conduct late trend ransomware geopolitical conflict order provide overview current cyber climate light recent event contribute literature investigate recent ransomware attack focus ransom paid money transfer criminal cryptocurrencies might recover sustainability cybersecurity link issue yet sufficiently debate amid late event ukraine ransomware gang involvement geopolitical conflict study provide researcher mean assess vulnerability reveal path intend research
An intelligent dynamic cyber physical system threat detection system for ensuring secured communication in 6G autonomous vehicle networks,https://link.springer.com/article/10.1038/s41598-024-70835-3,05 September 2024,"Shanthalakshmi M, Ponmagal R S","Smart cities have developed advanced technology that improves people’s lives. A collaboration of smart cities with autonomous vehicles shows the development towards a more advanced future. Cyber-physical system (CPS) are used blend the cyber and physical world, combined with electronic and mechanical systems, Autonomous vehicles (AVs) provide an ideal model of CPS. The integration of 6G technology with Autonomous Vehicles (AVs) marks a significant advancement in Intelligent Transportation Systems (ITS), offering enhanced self-sufficiency, intelligence, and effectiveness. Autonomous vehicles rely on a complex network of sensors, cameras, and software to operate. A cyber-attack could interfere with these systems, leading to accidents, injuries, or fatalities. Autonomous vehicles are often connected to broader transportation networks and infrastructure. A successful cyber-attack could disrupt not only individual vehicles but also public transportation systems, causing widespread chaos and economic damage. Autonomous vehicles communicate with other vehicles (V2V) and infrastructure (V2I) for safe and efficient operation. If these communication channels are compromised, it could lead to collisions, traffic jams, or other dangerous situations. So we present a novel approach to mitigating these security risks by leveraging pre-trained Convolutional Neural Network (CNN) models for dynamic cyber-attack detection within the cyber-physical systems (CPS) framework of AVs. The proposed Intelligent Intrusion Detection System (IIDS) employs a combination of advanced learning techniques, including Data Fusion, One-Class Support Vector Machine, Random Forest, and k-Nearest Neighbor, to improve detection accuracy. The study demonstrates that the EfficientNet model achieves superior performance with an accuracy of up to 99.97%, highlighting its potential to significantly enhance the security of AV networks. This research contributes to the development of intelligent cyber-security models that align with 6G standards, ultimately supporting the safe and efficient integration of AVs into smart cities.",smart city developed advanced technology improves people life collaboration smart city autonomous vehicle show development towards advanced future cyberphysical system cps use blend cyber physical world combine electronic mechanical system autonomous vehicle av provide ideal model cps integration g technology autonomous vehicle av mark significant advancement intelligent transportation system offering enhance selfsufficiency intelligence effectiveness autonomous vehicle rely complex network sensor camera software operate cyberattack could interfere system lead accident injury fatality autonomous vehicle often connect broader transportation network infrastructure successful cyberattack could disrupt individual vehicle also public transportation system cause widespread chaos economic damage autonomous vehicle communicate vehicle vv infrastructure vi safe efficient operation communication channel compromise could lead collision traffic jam dangerous situation present novel approach mitigate security risk leverage pretrained convolutional neural network cnn model dynamic cyberattack detection within cyberphysical system cps framework av propose intelligent intrusion detection system iids employ combination advanced learn technique include data fusion oneclass support vector machine random forest knearest neighbor improve detection accuracy study demonstrates efficientnet model achieves superior performance accuracy highlight potential significantly enhance security av network research contributes development intelligent cybersecurity model align g standard ultimately support safe efficient integration av smart city
Retaliating against cyber-attacks: a decision-taking framework for policy-makers and enforcers of international and cybersecurity law,https://link.springer.com/article/10.1365/s43439-024-00113-5,27 March 2024,"Sozon Leventopoulos, Kosmas Pipyros, Dimitris Gritzalis","Cyber warfare is a reality taking on increasing importance. Governments, state-sponsored actors, and non-state sponsored actors have used cyber-attacks as the “weapon of choice” due to their specific characteristics. Cyber-attacks can be highly targeted and focused, even tailored to a specific unit or system, providing limited to no physical destruction (unlike a cruise missile) and potentially resulting in no loss of life. There are several incident response frameworks and approaches that an organization can implement to enhance its security posture. Usually, these will address specific adverse events such as computer security incidents, which in turn are limited in scope and coverage, typically within an organization. Nations have made limited effort in confronting severe cyber-attacks targeting and/or threatening them, as well as in preventing these attacks from being launched. In this work, we identify and discuss a decision-taking framework that may allow state actors to adopt new options against severe cyber-attacks, not always complying with international norms. Such options are neither encouraged nor supported. On the contrary, we discuss them so that the international community is made aware of such potential frameworks. More specifically, by defining clear thresholds, roles, and responsibilities, by introducing a structured chain of command, and by identifying the potential of certain actions, policy makers can recognize an extended decision space that may lead to unpredictable deterrence options against cyber-attacks.",cyber warfare reality take increase importance government statesponsored actor nonstate sponsor actor use cyberattacks weapon choice due specific characteristic cyberattacks highly target focus even tailor specific unit system provide limited physical destruction unlike cruise missile potentially result loss life several incident response framework approach organization implement enhance security posture usually address specific adverse event computer security incident turn limited scope coverage typically within organization nation make limited effort confront severe cyberattacks target andor threaten well prevent attack launch work identify discus decisiontaking framework may allow state actor adopt new option severe cyberattacks always comply international norm option neither encourage support contrary discus international community make aware potential framework specifically define clear threshold role responsibility introduce structure chain command identify potential certain action policy maker recognize extend decision space may lead unpredictable deterrence option cyberattacks
A Tullock-contest-based approach for cyber security investments,https://link.springer.com/article/10.1007/s10479-022-04958-z,14 September 2022,"David Iliaev, Sigal Oren, Ella Segev","We study a cyber security game between a defender who wishes to defend her information assets and an attacker who tries to attack them. In this game the attacker and the defender choose how to distribute their resources in attacking or defending the different information assets. Given these investments the probability that an attack on a given asset is successful is an increasing function of the attacker’s investment and a decreasing function of the defender’s investment. The defender tries to minimize the expected damage from the attacks plus the cost of the defense while the attacker tries to maximize the expected damage from attacks minus his attacks’ expenses. The attacker is constrained by a budget. We compare two scenarios: a sequential move game and a simultaneous game. In the sequential game the defender moves first by deciding how much resources to allocate to the defense of each information asset and the attacker observes these investments and responds by allocating his resources in a manner that maximizes his expected utility. In the simultaneous game the attacker does not observe the defender’s decision before making his own. We analyze the best response strategies of the players and the equilibria of each of these games. Based on this analysis, we provide a tight upper bound on the reduction in defender’s costs that can be achieved by moving from the simultaneous to the sequential game.",study cyber security game defender wish defend information asset attacker try attack game attacker defender choose distribute resource attack defend different information asset give investment probability attack give asset successful increase function attacker investment decrease function defender investment defender try minimize expect damage attack plus cost defense attacker try maximize expect damage attack minus attack expense attacker constrain budget compare two scenario sequential move game simultaneous game sequential game defender move first decide much resource allocate defense information asset attacker observes investment responds allocate resource manner maximizes expect utility simultaneous game attacker observe defender decision make analyze best response strategy player equilibrium game base analysis provide tight upper bound reduction defender cost achieve move simultaneous sequential game
Security and energy efficient cyber-physical systems using predictive modeling approaches in wireless sensor network,https://link.springer.com/article/10.1007/s11276-023-03345-1,17 May 2023,"Abdullah Alghamdi, Ali M. Al Shahrani, Sultan Sughair AlYami, Ihtiram Raza Khan, P. S. G. Aruna Sri, Papiya Dutta, Ali Rizwan, Prashanth Venkatareddy","As a result of recent advancements in electronics technology, wireless sensor networks (WSNs) may now make use of a vast array of tiny sensors (WSN). WSN are viewed as problematic networks because of the environments in which they may operate and the technology they rely on. For instance, routing protocols need to be prepared for and capable of recovering from unexpected events like node failures and packet losses. The dynamic nature of these routing environments necessitates that every WSN routing protocol have mechanisms for adapting to new conditions. In many applications, security affects performance and energy efficiency. To provide such security services, we require resilient key management techniques. Security Power Aware Routing-Salp Swarm Optimization (SPAR-SSO) protocol uses a unique cryptosystem. SPAR-SSO uses connection quality estimation and power aware routing to reduce power consumption and delay while increasing packet delivery ratio. WSNs must conserve energy because the nodes are battery-powered. If the route with the greatest energy savings is constantly chosen for delivery, the nodes along this route will be overused and drained quickly, leading to network partitioning. In SPAR-SSO, an optimal path to the sink node is chosen. This technology is interesting because to its ease in enterprise and tractability in network transportation administration to deliver integrated services. It delivers a collision-free medium and minimizes entire energy expended in attainment the terminus, dropping energy each unit or packet. Moreover, Salp Swarm Optimization (SSO) is applied to optimize the results. The Packet Delivery Ratio (PDR) and End to End Delay is used as parameters to compare the performance of SPAR-SSO protocol. The results are compared with existing results and presented the success of the proposed method. Results show the proposed algorithm is suitable and compatibility with cyber-physical systems.",result recent advancement electronics technology wireless sensor network wsns may make use vast array tiny sensor wsn wsn view problematic network environment may operate technology rely instance rout protocol need prepared capable recover unexpected event like node failure packet loss dynamic nature rout environment necessitates every wsn rout protocol mechanism adapt new condition many application security affect performance energy efficiency provide security service require resilient key management technique security power aware routingsalp swarm optimization sparsso protocol us unique cryptosystem sparsso us connection quality estimation power aware rout reduce power consumption delay increase packet delivery ratio wsns must conserve energy node batterypowered route great energy saving constantly chosen delivery node along route overuse drain quickly lead network partition sparsso optimal path sink node chosen technology interest ease enterprise tractability network transportation administration deliver integrate service delivers collisionfree medium minimizes entire energy expend attainment terminus drop energy unit packet moreover salp swarm optimization sso apply optimize result packet delivery ratio pdr end end delay use parameter compare performance sparsso protocol result compare exist result present success propose method result show propose algorithm suitable compatibility cyberphysical system
An efficient cyber threat prediction using a novel artificial intelligence technique,https://link.springer.com/article/10.1007/s11042-024-18169-0,25 January 2024,"Pankaj Sharma, Jay Shankar Prasad, Shaheen, Shaik Khaleel Ahamed","Digital applications are ruling today's world with their advancement. However, offering security for that digital application is an important and complex task. Several detection-based security models have existed in the Artificial Intelligence (AI) vision. Still, the problem in threat detection has not ended because of the unique behavior of the different attacks. So, the present research has introduced a novel Cuttlefish-based Peephole Long Short Term Memory (CbP-LSTM) model proposed for predicting the cyber threat from the data defends against attacks. Initially, data were preprocessed by removing noise from the data using the noise filtering function. Then, the refined data is imported to the classification layer of the CbP-LSTM for performing the feature extraction and attack prediction tasks. Moreover, the proposed CbP-LSTM model was implemented in the Python tool with several performance metrics, whereas the parameters were calculated, such as accuracy, precision, Recall, and F-score. This proposed model produced outstanding results compared with the previous work by providing the highest predicted accuracy of cyber threats.",digital application ruling today world advancement however offering security digital application important complex task several detectionbased security model exist artificial intelligence ai vision still problem threat detection end unique behavior different attack present research introduce novel cuttlefishbased peephole long short term memory cbplstm model propose predict cyber threat data defends attack initially data preprocessed remove noise data use noise filter function refine data import classification layer cbplstm perform feature extraction attack prediction task moreover propose cbplstm model implement python tool several performance metric whereas parameter calculate accuracy precision recall fscore propose model produce outstanding result compare previous work provide high predict accuracy cyber threat
Optimal Resource Allocation and Feasible Hexagonal Topology for Cyber-Physical Systems,https://link.springer.com/article/10.1007/s11424-023-2256-z,12 June 2023,"Yifa Liu, Long Cheng","Networked cyber-physical systems are facing serious security threats from malicious attacks. It is noted that the networked cyber-physical system should take defense measures into account at the beginning of its construction. From the conservative defensive perspective, this paper proposes a robust optimal defense resource allocation strategy to reduce the maximum possible losses of the networked cyber-physical system caused by potential attacks. Then, based on the robust optimal allocation strategy, it can be proved that the topology of the networked cyber-physical system has a great influence on the loss function. In order to further improve security, the effects of adding redundant connections are investigated. Furthermore, by taking geographical knowledge into account, a hexagonal construction scheme is proposed for providing a geographically-feasible and economically-viable solution for building networked cyber-physical systems, where the loss function has a cubic decay.",networked cyberphysical system face serious security threat malicious attack note networked cyberphysical system take defense measure account begin construction conservative defensive perspective paper proposes robust optimal defense resource allocation strategy reduce maximum possible loss networked cyberphysical system cause potential attack base robust optimal allocation strategy prove topology networked cyberphysical system great influence loss function order improve security effect add redundant connection investigate furthermore take geographical knowledge account hexagonal construction scheme propose provide geographicallyfeasible economicallyviable solution building networked cyberphysical system loss function cubic decay
Investigating the effectiveness of a HyFlex cyber security training in a developing country: A case study,https://link.springer.com/article/10.1007/s10639-022-11038-z,11 April 2022,"Livinus Obiora Nweke, Anthony Jnr Bokolo, Gibson Mba, Emeka Nwigwe",Abstract Not Available,abstract available
